{
  "meta": {
    "source_title": "suyixinjian_chosen",
    "genre": "campus-redemption",
    "scope": "single-book-observation",
    "awaiting_aggregation": true,
    "min_books_required": 3
  },
  "payoff_density": {
    "per_thousand_words": 0.35,
    "payoff_types": [
      {
        "type": "情感回应",
        "ratio": 0.45,
        "buildup_length": 1800
      },
      {
        "type": "他人认可",
        "ratio": 0.25,
        "buildup_length": 1200
      },
      {
        "type": "反杀",
        "ratio": 0.15,
        "buildup_length": 1000
      },
      {
        "type": "身份揭露",
        "ratio": 0.15,
        "buildup_length": 1500
      }
    ]
  },
  "skeleton": "第一阶段（1-4章）：走投无路少女凭母亲遗信闯入陌生小镇，敲错门撞见催债完成与男主的强冲突初遇，奶奶嘴硬心软收留落下第一个情感回应；第二阶段（5-25章）：假钞揭露带来的连串危机，男主与暖色人物轮番托底，主角在绝境中建立羁绊并逐步逆袭；第三阶段（26章至终）：情感升温与真相揭露交织，异地分离靠物象牵挂维持悬念，命运困境（男主债务）与身份身世层层揭开，最终双向救赎收束。",
  "dry_spell_tolerance": "3章（约9000字）",
  "opening_analysis": {
    "chapter_1": {
      "first_300_words_task": "用极简白描建立「走投无路少女押注陌生小镇」的悬念核心，同时抛出母亲遗信这一情感锚点，让读者三问：她为什么逃、信指向谁、能否被收留",
      "hook_position": 350,
      "protagonist_intro_method": "先给环境与动作（撑伞站在青苔巷口），再切入倒叙揭示身世，让读者先好奇、后同情",
      "conflict_intro_position": 800,
      "golden_finger_reveal": "无传统金手指，以「母亲的遗信地址」作为贯穿全文的情感与命运线索，在开篇即点明其唯一性"
    },
    "chapter_2_3_task": "第2章用「敲错门撞见催债」制造意外冲突并引出男主原溯，完成男女主初遇的强钩子；第3章用「奶奶嘴硬心软收留」落地第一个情感回应，把悬念转化为希望，稳住读者继续追读"
  },
  "common_mistakes": "1.开篇直接抛大量背景设定而非进入冲突；2.主角情绪全靠内心独白堆砌而缺乏外部冲突驱动；3.男女主初遇平淡无钩子、缺乏强记忆点；4.苦难铺陈过度让读者压抑弃书、缺暖色人物对冲。",
  "paywall": {
    "position_chapter": 25,
    "cliffhanger_technique": "在情感关系或命运抉择的关键节点戛然而止，让主角或关键人物停在「即将行动却未行动」的悬置状态",
    "pre_paywall_buildup": "付费卡点前3-5章连续蓄力，逐步拉近男女主距离或逐步逼近真相，让读者对后续关系发展或真相揭露产生强烈期待"
  },
  "update_rhythm": {
    "chapters_per_day": 2,
    "burst_timing": "在情感高潮章（如关系突破、真相揭露）附近集中爆更3-5章，借助情绪惯性最大化追读与付费转化"
  },
  "retention_risk_points": [
    {
      "position": "第5-6章（假钞揭露后）",
      "reason": "主角连续受挫、苦难叠加，若处理不当易让读者感到压抑而流失",
      "mitigation": "用许岁然的两次出手相救和奶奶的倾囊相助及时对冲，让绝境中始终有暖色人物托底"
    },
    {
      "position": "第8-9章（日常过渡段）",
      "reason": "危机暂时解除后转入校园日常，缺乏强冲突，读者注意力可能下降",
      "mitigation": "用原溯「久别归来」的悬念和「满分秒答」的实力展示埋新钩子，保持信息牵引"
    },
    {
      "position": "中段异地期（约第85-129章）",
      "reason": "男女主空间分离、叙事转为各自单线，情感互动密度下降，可能流失追更读者",
      "mitigation": "用照片、礼物、书信等物象维持异地牵挂，穿插命运困境（原溯债务）保持悬念线"
    },
    {
      "position": "付费卡点后（约第25章前后）",
      "reason": "免费读者对后续走向不确定，转化瞬间可能犹豫",
      "mitigation": "卡点落在关系或真相的关键节点，并保证后续章节立即兑现期待，形成承诺-兑现的信任感"
    }
  ]
}